{
  "schemaVersion": 1,
  "matrixVersion": "0.1.0",
  "updatedOn": "2026-08-03",
  "productStage": "pre-alpha-contract-only",
  "supportClaimsEnabled": false,
  "statusDefinitions": {
    "supported": {
      "meaning": "The exact declared scope has a dispatchable implementation and complete public conformance evidence.",
      "claimRule": "Capabilities also require metadata, executor, input/output schemas, conformance fixture, and QA assertions."
    },
    "experimental": {
      "meaning": "A bounded path or contract exists but stability, coverage, or required evidence is incomplete.",
      "claimRule": "Must be labeled experimental at every API, CLI, and documentation boundary."
    },
    "manual": {
      "meaning": "The result depends on an explicit trusted human or external-runtime gate.",
      "claimRule": "Must remain unresolved until recorded manual evidence exists and can never become an automatic pass."
    },
    "unsupported": {
      "meaning": "The current product does not accept or promise the item.",
      "claimRule": "Reject or report unavailable before output mutation; never silently flatten or infer a fallback."
    }
  },
  "dimensions": {
    "inputs": [
      {
        "id": "capability-overlay",
        "label": "Data-only capability overlay and semantic bindings",
        "status": "unsupported",
        "disposition": "unavailable",
        "currentBasis": "Version 0.1.0 metadata and binding schemas plus a bounded in-memory ProjectOverlay/TemplateIndex resolver have public tests.",
        "limitations": ["The resolver consumes caller-supplied validated memory objects only; there is no ProjectOverlay loader, accepted project flow, staging authority, or support promotion."],
        "roadmap": "M1-002 through M2-005",
        "evidence": {
          "level": "automated-public",
          "artifacts": [
            {
              "type": "input-schema",
              "path": "schemas/contracts/capability-registry.schema.json",
              "note": "Closed registry metadata contract; referenced executors and capability schemas are not implemented by this artifact."
            },
            {
              "type": "input-schema",
              "path": "schemas/contracts/project-overlay.schema.json",
              "note": "Closed overlay and semantic-binding contract consumed by the bounded in-memory resolver; no loader or OOXML application is implied."
            },
            {
              "type": "contract",
              "path": "packages/core/src/project-dispatch-resolver.mjs",
              "note": "Snapshots and validates registry, overlay, index, and deck documents; resolves exact semantic targets and prepares an opaque dispatcher plan without I/O."
            },
            {
              "type": "qa-assertions",
              "path": "tests/source-slide-clone-fill.test.mjs",
              "note": "Rejects identity drift, missing or duplicate selections and bindings, ambiguous targets, kind mismatch, resource abuse, and partial-batch preflight."
            }
          ]
        }
      },
      {
        "id": "deck-slide-spec",
        "label": "Versioned deck and slide specification",
        "status": "unsupported",
        "disposition": "unavailable",
        "currentBasis": "Version 0.1.0 DeckSpec and SlideSpec schemas, a bounded in-memory resolver, and exact capability payload validation have public tests.",
        "limitations": ["There is no DeckSpec loader, accepted project input flow, OOXML staging authority, or rendered presentation output."],
        "roadmap": "M1-002 through M2-005",
        "evidence": {
          "level": "automated-public",
          "artifacts": [
            {
              "type": "input-schema",
              "path": "schemas/contracts/deck-spec.schema.json",
              "note": "Base deck/slide contract; its open payload alone is never dispatchable."
            },
            {
              "type": "contract",
              "path": "packages/core/src/project-dispatch-resolver.mjs",
              "note": "Preserves DeckSpec slide order, maps each slide to one exact selection, and keeps intermediate invocations private."
            },
            {
              "type": "conformance-fixture",
              "path": "fixtures/capabilities/source-slide-clone-fill/deck-spec.json",
              "note": "Repository-owned text-only two-slide data fixture; it is resolver evidence, not an accepted file or rendered PPTX."
            },
            {
              "type": "qa-assertions",
              "path": "tests/source-slide-clone-fill.test.mjs",
              "note": "Exercises ordered slide mapping, selection reuse, exact payload schemas, full-batch failure, immutability, and redaction."
            }
          ]
        }
      },
      {
        "id": "jpeg-asset",
        "label": "Local JPEG asset",
        "status": "unsupported",
        "disposition": "unavailable",
        "currentBasis": "No asset policy, decoder boundary, or placement executor exists.",
        "limitations": ["Local files are not searched or implicitly admitted."],
        "roadmap": "M1-002 and M2-003",
        "evidence": { "level": "none", "artifacts": [] }
      },
      {
        "id": "latex-formula",
        "label": "LaTeX formula input",
        "status": "unsupported",
        "disposition": "unavailable",
        "currentBasis": "The optional Pandoc/OMML adapter is not implemented.",
        "limitations": ["Pandoc is not bundled and predecessor observations are not public evidence."],
        "roadmap": "M2-004",
        "evidence": { "level": "none", "artifacts": [] }
      },
      {
        "id": "macro-enabled-presentation",
        "label": "Macro-enabled presentation or template",
        "status": "unsupported",
        "disposition": "reject",
        "currentBasis": "The bounded secure-ingestion lane rejects macro-enabled content types, VBA paths, and macro relationship types before semantic inspection.",
        "limitations": ["This is rejection evidence for the narrow public profile, not macro compatibility or a published input flow."],
        "roadmap": "Maintain rejection policy",
        "evidence": {
          "level": "automated-public",
          "artifacts": [
            {
              "type": "contract",
              "path": "packages/core/src/ooxml-package-view.mjs",
              "note": "Fail-closed high-risk path, content-type, relationship-type, and XML vocabulary checks."
            },
            {
              "type": "qa-assertions",
              "path": "tests/secure-template-ingestion.test.mjs",
              "note": "Runtime-generated macro-enabled content-type, VBA part, and macro relationship rejection mutations."
            }
          ]
        }
      },
      {
        "id": "other-office-or-design-input",
        "label": "PDF, office, design, HTML, or image document import",
        "status": "unsupported",
        "disposition": "reject",
        "currentBasis": "Semantic import from arbitrary document/design formats is a 0.x non-goal.",
        "limitations": ["Individual local image assets are separate future inputs, not document import."],
        "roadmap": "No 0.x roadmap",
        "evidence": { "level": "none", "artifacts": [] }
      },
      {
        "id": "png-asset",
        "label": "Local PNG asset",
        "status": "unsupported",
        "disposition": "unavailable",
        "currentBasis": "No asset policy, decoder boundary, or placement executor exists.",
        "limitations": ["Local files are not searched or implicitly admitted."],
        "roadmap": "M1-002 and M2-003",
        "evidence": { "level": "none", "artifacts": [] }
      },
      {
        "id": "potx-template",
        "label": "User-owned POTX template",
        "status": "unsupported",
        "disposition": "unavailable",
        "currentBasis": "A bounded internal source-to-index lane securely ingests the repository-owned minimal POTX grammar, but no published package/CLI or arbitrary user-template compatibility class exists.",
        "limitations": ["The positive grammar is deliberately narrow; generated fixture output is test data and committed POTX binaries remain rejected."],
        "roadmap": "M3-001 plus explicit future compatibility evidence",
        "evidence": {
          "level": "automated-public",
          "artifacts": [
            {
              "type": "contract",
              "path": "packages/core/src/secure-template-ingestion.mjs",
              "note": "One-step ProjectContext-bound stable-file-to-index boundary with fixed limits."
            },
            {
              "type": "qa-assertions",
              "path": "tests/secure-template-ingestion.test.mjs",
              "note": "Exact public POTX golden plus filesystem, ZIP, XML, OPC, and high-risk rejection mutations."
            }
          ]
        }
      },
      {
        "id": "pptx-template",
        "label": "User-owned PPTX template",
        "status": "unsupported",
        "disposition": "unavailable",
        "currentBasis": "A bounded internal source-to-index lane securely ingests the repository-owned minimal PPTX grammar, but no published package/CLI or arbitrary user-template compatibility class exists.",
        "limitations": ["The positive grammar is deliberately narrow; generated fixture output is test data and committed PPTX binaries remain rejected."],
        "roadmap": "M3-001 plus explicit future compatibility evidence",
        "evidence": {
          "level": "automated-public",
          "artifacts": [
            {
              "type": "contract",
              "path": "packages/core/src/secure-template-ingestion.mjs",
              "note": "One-step ProjectContext-bound stable-file-to-index boundary with fixed limits."
            },
            {
              "type": "qa-assertions",
              "path": "tests/secure-template-ingestion.test.mjs",